{
  "$schema": "https://json-schema.org/draft/2020-12/schema",
  "title": "TaskRecord",
  "type": "object",
  "required": [
    "task_id",
    "feature_id",
    "engine",
    "stage",
    "owner",
    "status",
    "inputs",
    "expected_outputs"
  ],
  "properties": {
    "task_id": { "type": "string", "minLength": 1 },
    "feature_id": { "type": "string", "minLength": 1 },
    "engine": { "type": "string", "minLength": 1 },
    "stage": { "type": "string", "minLength": 1 },
    "owner": { "type": "string", "minLength": 1 },
    "status": { "type": "string", "minLength": 1 },
    "inputs": {
      "type": "array",
      "items": { "type": "string" }
    },
    "expected_outputs": {
      "type": "array",
      "items": { "type": "string" }
    }
  }
}